{"category":"ui","compatibility":{"application_definition":"factory/v1","profile":"internal-approval-app"},"digest":"sha256:6f9fef353cc56cbb1e99163f544c46ac2c4c79b203ac48c9059ebab73459c8f5","input_schema":{"additionalProperties":false,"properties":{"heading":{"minLength":1,"type":"string"},"settings":{"items":{"additionalProperties":false,"properties":{"key":{"minLength":1,"type":"string"},"label":{"minLength":1,"type":"string"}},"required":["key","label"],"type":"object"},"minItems":1,"type":"array"}},"required":["heading","settings"],"type":"object"},"inventory":[{"path":"adapter.json","sha256":"sha256:6d3d2dbf5c0c8405a69fc5701f805ec5c8aea0408f09a7fccfb1801df185c5f8"},{"path":"canonical-ui.json","sha256":"sha256:d6b7ec332c688b1d70e36324159b7ccea4fac14c59e81d67d7b463ac3b817977"},{"path":"fixtures/valid-input.json","sha256":"sha256:52ad107b38930a464ee9ef1b895aa632124dab54db111e14e85713e92a5e5cf2"},{"path":"templates/SystemSettingsPage.tsx","sha256":"sha256:941abd3a3fe665a9bfa9dbfc1b068e0473a0704c88afd25c449daeea764a2aa9"},{"path":"tests/test_package.py","sha256":"sha256:496bb07f8d43c8f2a9b6ff04e6a09bb2698d149748cfd16fa8e0ce07e261fc01"},{"path":"trust.json","sha256":"sha256:732f11bc3d19ae905aeaf37b3d7e59d7172a0a8a2088fd835c62b402282c5df0"}],"key":"ui.system-settings-page","lifecycle":"candidate","output_slots":["frontend/routes/system-settings"],"package_root":".","provides":["ui.route.system-settings"],"requires":[{"key":"ui.app-shell","version":"2.3.0"}],"schema_version":"factory-component/v1","verification":{"license_expression":"MIT","license_list_version":"3.0","provenance_reference":null,"sbom_reference":null,"source_revision":"c0ffee0","status":"passed","verified_at":"2026-07-26T00:00:00Z"},"version":"2.3.0"}
