{"category":"ui","compatibility":{"application_definition":"factory/v1","profile":"internal-approval-app"},"digest":"sha256:35e6fcb3369a9ec645b51f6580642bfe833e681d7097f91a66df25577b9201ee","input_schema":{"additionalProperties":false,"properties":{"heading":{"minLength":1,"type":"string"},"settings":{"items":{"additionalProperties":false,"properties":{"key":{"minLength":1,"type":"string"},"label":{"minLength":1,"type":"string"}},"required":["key","label"],"type":"object"},"minItems":1,"type":"array"}},"required":["heading","settings"],"type":"object"},"inventory":[{"path":"adapter.json","sha256":"sha256:ef471926afa961f46962485980964453dae80ccb2038a52f15b68fb338aaec59"},{"path":"fixtures/valid-input.json","sha256":"sha256:25eef4a76c9c02932645582ff3654249dc00e2ecb8100255d964d71d4bcda5bc"},{"path":"templates/SystemSettingsPage.tsx","sha256":"sha256:b08c3c95446bf74a158c9b2ff4b72610131b18239a89d441f41265b479a37683"},{"path":"tests/test_package.py","sha256":"sha256:df9d7f8aef18373f3c65ed64754e4a169164ff4e2844f89945145de78d9df5e7"}],"key":"ui.system-settings-page","lifecycle":"golden","output_slots":["frontend/routes/system-settings"],"package_root":".","provides":["ui.route.system-settings"],"requires":[{"key":"ui.app-shell","version":"1.0.0"}],"schema_version":"factory-component/v1","verification":{"license_expression":"MIT","license_list_version":"3.0","provenance_reference":null,"sbom_reference":null,"source_revision":"c0ffee0","status":"passed","verified_at":"2026-07-26T00:00:00Z"},"version":"1.0.0"}
