{
  "schema_version": "factory-component/v1",
  "key": "ui.login-page",
  "version": "1.0.0",
  "category": "ui",
  "package_root": ".",
  "digest": "sha256:9eab0475992602fccca502f7fb0e87d12962cde47ab08e786068ba41c2569d13",
  "inventory": [
    {"path": "adapter.json", "sha256": "sha256:fbe90ad032007b44153a3c91de0215d57da5ec366bf7c77bda8770a9960d1f66"},
    {"path": "fixtures/inputs.json", "sha256": "sha256:5583acfed165dc6c5b77519fd94c83f30fbf4dc14cbf0c419763efc5383de53d"},
    {"path": "templates/login.tsx", "sha256": "sha256:9b09fcdbd5fd0fdcbdcffd61de0a18d241585fc2b874a0502ad119fb45c6867e"},
    {"path": "tests/README.md", "sha256": "sha256:d973d6838899fcfe8608232df752dc6cba4825dc2fcf9d67dfdbd449b67c43e8"}
  ],
  "provides": ["ui.authentication.login"],
  "requires": [],
  "compatibility": {"profile": "internal-approval-app", "application_definition": "factory/v1"},
  "input_schema": {
    "type": "object",
    "additionalProperties": false,
    "properties": {"title": {"type": "string", "minLength": 1}},
    "required": ["title"]
  },
  "output_slots": ["frontend/routes/login"],
  "lifecycle": "golden",
  "verification": {
    "status": "passed",
    "source_revision": "0123456789abcdef",
    "verified_at": "2026-07-26T00:00:00Z",
    "license_expression": "MIT",
    "license_list_version": "3.0",
    "sbom_reference": null,
    "provenance_reference": null
  }
}
