{"category":"ui","compatibility":{"application_definition":"factory/v1","profile":"internal-approval-app"},"digest":"sha256:44cde6d5e207e64759c6978ac31d7cf99e2061b3a54c22d1c0a0fa6d8e80d9d2","input_schema":{"additionalProperties":false,"properties":{"approve_label":{"minLength":1,"type":"string"},"heading":{"minLength":1,"type":"string"},"reject_label":{"minLength":1,"type":"string"}},"required":["heading","approve_label","reject_label"],"type":"object"},"inventory":[{"path":"adapter.json","sha256":"sha256:03c616840cd4a66bc5503981710b8318e1f6dd0a595c0511c3b7272739063734"},{"path":"fixtures/valid-input.json","sha256":"sha256:0757fe7d3f3234c63a81f73bfb0413c883c360c1c1a557a4bd5b74202b2b7e79"},{"path":"templates/ApprovalQueue.tsx","sha256":"sha256:87166ecfbccbcb55591bbe1eff11d5f1c29959813ae9c4c0be56c144e6e8548c"},{"path":"tests/test_package.py","sha256":"sha256:0ab0da25ca5001dc218b95ae05aaf2d1d0e708b531b916e6706c3d23d6a64d79"}],"key":"ui.approval-queue","lifecycle":"golden","output_slots":["frontend/features/approval-queue"],"package_root":".","provides":["ui.approval.queue"],"requires":[{"key":"ui.app-shell","version":"1.0.0"}],"schema_version":"factory-component/v1","verification":{"license_expression":"MIT","license_list_version":"3.0","provenance_reference":null,"sbom_reference":null,"source_revision":"c0ffee0","status":"passed","verified_at":"2026-07-26T00:00:00Z"},"version":"1.0.0"}
