{"category":"ui","compatibility":{"application_definition":"factory/v1","profile":"internal-approval-app"},"digest":"sha256:46593ddabd29ab456dc766e5d60d099b1dbb9fc937bcab30c24428cfd6ddd756","input_schema":{"additionalProperties":false,"properties":{"approve_label":{"minLength":1,"type":"string"},"heading":{"minLength":1,"type":"string"},"reject_label":{"minLength":1,"type":"string"}},"required":["heading","approve_label","reject_label"],"type":"object"},"inventory":[{"path":"adapter.json","sha256":"sha256:c939eb59dc4fa75faba5527055f871fbbd6e24186848aa9850fb73e0163de735"},{"path":"canonical-ui.json","sha256":"sha256:c4ff57882077deff5c6b5f0ecf39a46d256ee5d43fe234341e3ab805cac51d05"},{"path":"fixtures/valid-input.json","sha256":"sha256:20d5a345b5760b4ba25e284fb53de6deb90fdb57773c0db2d3b529a0c608ebba"},{"path":"templates/ApprovalQueue.tsx","sha256":"sha256:b6729859095ddde6c78ff8c62e6ad99cb96e1c61a65babcef26e00537bf1f19f"},{"path":"tests/test_package.py","sha256":"sha256:93ae11b24335ff7d4cb52f451b6310f64a816469018a5b831061bcd567fb3746"},{"path":"trust.json","sha256":"sha256:e0b56aad8d462ec9f0452fc31c9897ea8908c7d43f8e75eb6ebb7f3464d0c9d1"}],"key":"ui.approval-queue","lifecycle":"candidate","output_slots":["frontend/features/approval-queue"],"package_root":".","provides":["ui.approval.queue"],"requires":[{"key":"ui.app-shell","version":"2.2.0"}],"schema_version":"factory-component/v1","verification":{"license_expression":"MIT","license_list_version":"3.0","provenance_reference":null,"sbom_reference":null,"source_revision":"c0ffee0","status":"passed","verified_at":"2026-07-26T00:00:00Z"},"version":"2.2.0"}
