{"category":"backend","compatibility":{"application_definition":"factory/v1","profile":"internal-approval-app"},"digest":"sha256:ed93894465b3ba8fa8eb96e296f9c09821ba6ab2d0d47508d0c413a3c9683c28","input_schema":{"additionalProperties":false,"properties":{"allowed_roles":{"items":{"minLength":1,"type":"string"},"minItems":1,"type":"array","uniqueItems":true},"cookie_name":{"pattern":"^[a-z][a-z0-9_]{0,62}$","type":"string"},"local_users_env":{"pattern":"^[A-Z][A-Z0-9_]{0,62}$","type":"string"},"session_ttl_seconds":{"maximum":86400,"minimum":60,"type":"integer"},"signing_key_env":{"pattern":"^[A-Z][A-Z0-9_]{0,62}$","type":"string"}},"required":["allowed_roles","cookie_name","local_users_env","signing_key_env","session_ttl_seconds"],"type":"object"},"inventory":[{"path":"adapter.json","sha256":"sha256:4198c610d795ea8b85cb5608d5205202d8726886714cd970c0841315c9324915"},{"path":"fixtures/inputs.json","sha256":"sha256:6c429d503a365eb11eb241c73336f90caed3c2a2e657ac7c97a2b0b07607fc57"},{"path":"templates/session_auth.py.tmpl","sha256":"sha256:f3bca27210fa641c8458b5ae8d952537e2bfd22707329d457e4299bf2e9275cf"},{"path":"tests/test_package.py","sha256":"sha256:2497014aba3c6746698678ea4fae567289c244e6426bf17274b00460f2078b06"}],"key":"backend.session-auth","lifecycle":"golden","output_slots":["backend/auth"],"package_root":".","provides":["backend.authentication.session"],"requires":[],"schema_version":"factory-component/v1","verification":{"license_expression":"MIT","license_list_version":"3.0","provenance_reference":null,"sbom_reference":null,"source_revision":"c15a7e0c0ffee001","status":"passed","verified_at":"2026-07-26T04:10:00Z"},"version":"1.0.0"}
