{"category":"ui","compatibility":{"application_definition":"factory/v1","profile":"internal-approval-app"},"digest":"sha256:699d2c262187a9bac1360528bf9754ce15f269b4d61e2e4fd7e0083b805a301f","input_schema":{"additionalProperties":false,"properties":{"audit_heading":{"minLength":1,"type":"string"},"navigation":{"items":{"additionalProperties":false,"properties":{"href":{"pattern":"^/","type":"string"},"label":{"minLength":1,"type":"string"}},"required":["label","href"],"type":"object"},"minItems":1,"type":"array"},"product_name":{"minLength":1,"type":"string"}},"required":["product_name","audit_heading","navigation"],"type":"object"},"inventory":[{"path":"adapter.json","sha256":"sha256:481ccedf396e3d9ad1294b5d1aab321a9bfa4264fa1de4498dc3c8814e495fc9"},{"path":"fixtures/valid-input.json","sha256":"sha256:14f44b0ba0cea344a26c721872ea83c24161d8e3048c0c222e844a94db3a5e72"},{"path":"templates/ApplicationShell.tsx","sha256":"sha256:90d802a9c49160e9427726ec606f43c2af2f3fb5e046c5b7efe942abca8c6231"},{"path":"templates/AuditLog.tsx","sha256":"sha256:19fdd8ddd3f246f2056456aa9614b74196a0f2bafb3bb45fa8b0a2b051d607fd"},{"path":"tests/test_package.py","sha256":"sha256:9b81cecb218ba1e11db3aae2d7a92cbcc69fbccf853f5ac73595e0e77e8cba2a"}],"key":"ui.app-shell","lifecycle":"golden","output_slots":["frontend/app-shell","frontend/features/audit"],"package_root":".","provides":["ui.application.shell","ui.application.audit-view"],"requires":[],"schema_version":"factory-component/v1","verification":{"license_expression":"MIT","license_list_version":"3.0","provenance_reference":null,"sbom_reference":null,"source_revision":"c0ffee0","status":"passed","verified_at":"2026-07-26T00:00:00Z"},"version":"1.0.0"}
