{"category":"ui","compatibility":{"application_definition":"factory/v1","profile":"internal-approval-app"},"digest":"sha256:75f19057f02feace2f820d5ee1deab3aad7f2216a538707cef54358c77ac5926","input_schema":{"additionalProperties":false,"properties":{"product_name":{"minLength":1,"type":"string"},"sign_in_label":{"minLength":1,"type":"string"}},"required":["product_name","sign_in_label"],"type":"object"},"inventory":[{"path":"adapter.json","sha256":"sha256:79992c90b820aaf5a03d8c627839007a033d4fdaf828a89fd59b0e25502a0ecb"},{"path":"canonical-ui.json","sha256":"sha256:6fa7cbcc0b48ce9e2f01db76e3b738e80119e096570e6d1d634c725dda3916bf"},{"path":"fixtures/valid-input.json","sha256":"sha256:4b1b40a43a41922eef03be096b12a823fa77ea0190965610ac22c0e03c976499"},{"path":"templates/LoginPage.tsx","sha256":"sha256:3865b97d206c5d88278e72daf92b5297d071c23bf8948ce58a3544336079a1b3"},{"path":"tests/test_package.py","sha256":"sha256:d8d488b4c3cf0bb96510c89fae491415aaa7e938248875330d3c2e3b8146b30c"},{"path":"trust.json","sha256":"sha256:2e02588f8a76ad8cb09cdde9c478b19ea64d79fde3e46cef5dde49512369aeef"}],"key":"ui.login-page","lifecycle":"golden","output_slots":["frontend/routes/login"],"package_root":".","provides":["ui.authentication.login"],"requires":[{"key":"ui.app-shell","version":"2.1.0"}],"schema_version":"factory-component/v1","verification":{"license_expression":"MIT","license_list_version":"3.0","provenance_reference":null,"sbom_reference":null,"source_revision":"c0ffee0","status":"passed","verified_at":"2026-07-26T00:00:00Z"},"version":"2.1.0"}