{"category":"ui","compatibility":{"application_definition":"factory/v1","profile":"internal-approval-app"},"digest":"sha256:f5d3ce24493c063d650569426782caa9c25f7a72bbb391f5437c0003ba507986","input_schema":{"additionalProperties":false,"properties":{"editable_fields":{"items":{"minLength":1,"type":"string"},"minItems":1,"type":"array"},"heading":{"minLength":1,"type":"string"}},"required":["heading","editable_fields"],"type":"object"},"inventory":[{"path":"adapter.json","sha256":"sha256:0c320baaff0e6afc7b9bf4386598dd2ad9a0204294c409048a0784799f93aab0"},{"path":"canonical-ui.json","sha256":"sha256:d6b7ec332c688b1d70e36324159b7ccea4fac14c59e81d67d7b463ac3b817977"},{"path":"fixtures/valid-input.json","sha256":"sha256:8f0237c279f54a88821618d0145edbcc35af54139f37f8d65d47b3c86ae43117"},{"path":"templates/ProfilePage.tsx","sha256":"sha256:f27bb97f60d9096b4fbfd8869083cc7bb0a5bb62f635e9539b936c76ead8f91b"},{"path":"tests/test_package.py","sha256":"sha256:d55b23c9f96c420547bb12eaee47041f230f7f495adc645b21e57ab6b3eef697"},{"path":"trust.json","sha256":"sha256:c09dfe203369e24ddfe5f782f2a71297d8b516cbc4be34bbcf4b1eba2928d304"}],"key":"ui.profile-page","lifecycle":"candidate","output_slots":["frontend/routes/profile"],"package_root":".","provides":["ui.route.profile"],"requires":[{"key":"ui.app-shell","version":"2.4.0"}],"schema_version":"factory-component/v1","verification":{"license_expression":"MIT","license_list_version":"3.0","provenance_reference":null,"sbom_reference":null,"source_revision":"c0ffee0","status":"passed","verified_at":"2026-07-27T00:00:00Z"},"version":"2.4.0"}
