{"category":"ui","compatibility":{"application_definition":"factory/v1","profile":"internal-approval-app"},"digest":"sha256:c4e2bcf9453e68cc75c0791f276e593c722a601717ce61b2c997b3e3616d7712","input_schema":{"additionalProperties":false,"properties":{"product_name":{"minLength":1,"type":"string"},"sign_in_label":{"minLength":1,"type":"string"}},"required":["product_name","sign_in_label"],"type":"object"},"inventory":[{"path":"adapter.json","sha256":"sha256:ce621a93cd7d21fbe5a92dce289cc1226abab0dcc960b790f532bdb4a76121ef"},{"path":"canonical-ui.json","sha256":"sha256:d6b7ec332c688b1d70e36324159b7ccea4fac14c59e81d67d7b463ac3b817977"},{"path":"fixtures/valid-input.json","sha256":"sha256:4b1b40a43a41922eef03be096b12a823fa77ea0190965610ac22c0e03c976499"},{"path":"templates/LoginPage.tsx","sha256":"sha256:14aba6c2b36485f45a56b1645a8c52144eb3fb992061a480f0e8d8942b27cf17"},{"path":"tests/test_package.py","sha256":"sha256:6ec9e9297fdf293a92c38e1873973a2121a32cf56f42795aabbcb13d9c62581e"},{"path":"trust.json","sha256":"sha256:3b8e1d43e1633285eda305b968ad88e4cfe803579d11bb495dd5dd261b50b5af"}],"key":"ui.login-page","lifecycle":"candidate","output_slots":["frontend/routes/login"],"package_root":".","provides":["ui.authentication.login"],"requires":[{"key":"ui.app-shell","version":"2.4.0"}],"schema_version":"factory-component/v1","verification":{"license_expression":"MIT","license_list_version":"3.0","provenance_reference":null,"sbom_reference":null,"source_revision":"c0ffee0","status":"passed","verified_at":"2026-07-26T00:00:00Z"},"version":"2.4.0"}
