{"category":"ui","compatibility":{"application_definition":"factory/v1","profile":"internal-approval-app"},"digest":"sha256:826c927c7f127ea697c20c14beb5e0e936742ce902e438c80c1b21ade8d7fd97","input_schema":{"additionalProperties":false,"properties":{"empty_state":{"minLength":1,"type":"string"},"heading":{"minLength":1,"type":"string"}},"required":["heading","empty_state"],"type":"object"},"inventory":[{"path":"adapter.json","sha256":"sha256:33b2160b74dbcf94a068764ab83ec12831353c9d810cf8b01f0bbe1ba67eff40"},{"path":"canonical-ui.json","sha256":"sha256:d6b7ec332c688b1d70e36324159b7ccea4fac14c59e81d67d7b463ac3b817977"},{"path":"fixtures/valid-input.json","sha256":"sha256:4956f382fbc519194a336db0f1bd47820267f4015ef615e06c28b1a3af512469"},{"path":"templates/MyRequests.tsx","sha256":"sha256:59d4ca6acebb8dd9d0f90fd648ce235e2afb5de9be3bccaeda7f42dc96d445c9"},{"path":"tests/test_package.py","sha256":"sha256:da145078c5cf3838e5cf173bf3e9bb7622d69098617e8aa1bdb65c35cc05de18"},{"path":"trust.json","sha256":"sha256:6384838ecfaeb9239fdfaf2a76a59a4d75e32e44e2f6f2599fcd982ba0a7eb2c"}],"key":"ui.my-requests","lifecycle":"candidate","output_slots":["frontend/features/my-requests"],"package_root":".","provides":["ui.approval.my-requests"],"requires":[{"key":"ui.app-shell","version":"2.3.0"}],"schema_version":"factory-component/v1","verification":{"license_expression":"MIT","license_list_version":"3.0","provenance_reference":null,"sbom_reference":null,"source_revision":"c0ffee0","status":"passed","verified_at":"2026-07-26T00:00:00Z"},"version":"2.3.0"}
