{"category":"ui","compatibility":{"application_definition":"factory/v1","profile":"internal-approval-app"},"digest":"sha256:0fdf3217ef6f61ad26b7a65681eebeaec7cb5ea6c16a7c15b83b8fe1d7b8e766","input_schema":{"additionalProperties":false,"properties":{"editable_fields":{"items":{"minLength":1,"type":"string"},"minItems":1,"type":"array"},"heading":{"minLength":1,"type":"string"}},"required":["heading","editable_fields"],"type":"object"},"inventory":[{"path":"adapter.json","sha256":"sha256:e0af1266dc539e5b6e594c607346b946eca5dc1a57db7075ae98997a981ceb7b"},{"path":"canonical-ui.json","sha256":"sha256:d6b7ec332c688b1d70e36324159b7ccea4fac14c59e81d67d7b463ac3b817977"},{"path":"fixtures/valid-input.json","sha256":"sha256:8f0237c279f54a88821618d0145edbcc35af54139f37f8d65d47b3c86ae43117"},{"path":"templates/ProfilePage.tsx","sha256":"sha256:27074f17e728fb3645db4b6d228f516b6e737a9098c75042e042c9ef69f26bc4"},{"path":"tests/test_package.py","sha256":"sha256:224480210fad8217fd2617ed57bed8871d774070723ecfa78cca682f060788c6"},{"path":"trust.json","sha256":"sha256:0d497e679deda82abbfe799cd389873a76bad27b10e1d0223b2f18f2f886c4f4"}],"key":"ui.profile-page","lifecycle":"candidate","output_slots":["frontend/routes/profile"],"package_root":".","provides":["ui.route.profile"],"requires":[{"key":"ui.app-shell","version":"2.3.0"}],"schema_version":"factory-component/v1","verification":{"license_expression":"MIT","license_list_version":"3.0","provenance_reference":null,"sbom_reference":null,"source_revision":"c0ffee0","status":"passed","verified_at":"2026-07-27T00:00:00Z"},"version":"2.3.0"}
