{"category":"ui","compatibility":{"application_definition":"factory/v1","profile":"internal-approval-app"},"digest":"sha256:92b0f8a4b3c2f6fd67a360e8798353542b6450cfdf0f27bab684e826f07bf537","input_schema":{"additionalProperties":false,"properties":{"approve_label":{"minLength":1,"type":"string"},"heading":{"minLength":1,"type":"string"},"reject_label":{"minLength":1,"type":"string"}},"required":["heading","approve_label","reject_label"],"type":"object"},"inventory":[{"path":"adapter.json","sha256":"sha256:99e54ae6d7a66867b8b34125cefb00d6505c4def37060512642a544178d270d4"},{"path":"canonical-ui.json","sha256":"sha256:d6b7ec332c688b1d70e36324159b7ccea4fac14c59e81d67d7b463ac3b817977"},{"path":"fixtures/valid-input.json","sha256":"sha256:20d5a345b5760b4ba25e284fb53de6deb90fdb57773c0db2d3b529a0c608ebba"},{"path":"templates/ApprovalQueue.tsx","sha256":"sha256:42cc926a8cd6b23430197edd77d2de8d39c6d1e2540bc2e98d77e5e651a2ee69"},{"path":"tests/test_package.py","sha256":"sha256:df57b89add8a6d862377a3481bc8ef02509905c8ad31696a09239bd1ff7523f6"},{"path":"trust.json","sha256":"sha256:869adb272b0b67937c2e00b56740fdec7251e306047eda3a711ab9bcefbce9a0"}],"key":"ui.approval-queue","lifecycle":"candidate","output_slots":["frontend/features/approval-queue"],"package_root":".","provides":["ui.approval.queue"],"requires":[{"key":"ui.app-shell","version":"2.3.0"}],"schema_version":"factory-component/v1","verification":{"license_expression":"MIT","license_list_version":"3.0","provenance_reference":null,"sbom_reference":null,"source_revision":"c0ffee0","status":"passed","verified_at":"2026-07-26T00:00:00Z"},"version":"2.3.0"}
