{"category":"ui","compatibility":{"application_definition":"factory/v1","profile":"internal-approval-app"},"digest":"sha256:680d64c9e74f2ff41214b6d5e323931c739bf0dcf8e87114d9533ffee482281b","input_schema":{"additionalProperties":false,"properties":{"approve_label":{"minLength":1,"type":"string"},"heading":{"minLength":1,"type":"string"},"reject_label":{"minLength":1,"type":"string"}},"required":["heading","approve_label","reject_label"],"type":"object"},"inventory":[{"path":"adapter.json","sha256":"sha256:99604a5b524490e53c57d9d7041752cfead69eda1ca25434c44a481096652e13"},{"path":"canonical-ui.json","sha256":"sha256:d6b7ec332c688b1d70e36324159b7ccea4fac14c59e81d67d7b463ac3b817977"},{"path":"fixtures/valid-input.json","sha256":"sha256:20d5a345b5760b4ba25e284fb53de6deb90fdb57773c0db2d3b529a0c608ebba"},{"path":"templates/ApprovalQueue.tsx","sha256":"sha256:cad367ba2dddb50a4a7b24366a785247f2bca8eb80b846e214dd03f7ed52c6c2"},{"path":"tests/test_package.py","sha256":"sha256:a740884a34ff603df6a78d7e3dec09d7ce1c81f4d637e8cb0b9f80e73e18a0a8"},{"path":"trust.json","sha256":"sha256:05c7021d57d6feef8cae132383da3099b81b08cc11e552c6cf4b40aadf06d76d"}],"key":"ui.approval-queue","lifecycle":"candidate","output_slots":["frontend/features/approval-queue"],"package_root":".","provides":["ui.approval.queue"],"requires":[{"key":"ui.app-shell","version":"2.4.0"}],"schema_version":"factory-component/v1","verification":{"license_expression":"MIT","license_list_version":"3.0","provenance_reference":null,"sbom_reference":null,"source_revision":"c0ffee0","status":"passed","verified_at":"2026-07-26T00:00:00Z"},"version":"2.4.0"}
