{"category":"ui","compatibility":{"application_definition":"factory/v1","profile":"internal-approval-app"},"digest":"sha256:5cb6d34d4ab9a16879a6d853b1f6cdc5a4a69050bcd27bd92900d2c53afd04f6","input_schema":{"additionalProperties":false,"properties":{"approve_label":{"minLength":1,"type":"string"},"heading":{"minLength":1,"type":"string"},"reject_label":{"minLength":1,"type":"string"}},"required":["heading","approve_label","reject_label"],"type":"object"},"inventory":[{"path":"adapter.json","sha256":"sha256:98ac49d21806ed8334541c1a331589ce4d33a6000c34fed545048cac922bdb0e"},{"path":"canonical-ui.json","sha256":"sha256:6fa7cbcc0b48ce9e2f01db76e3b738e80119e096570e6d1d634c725dda3916bf"},{"path":"fixtures/valid-input.json","sha256":"sha256:20d5a345b5760b4ba25e284fb53de6deb90fdb57773c0db2d3b529a0c608ebba"},{"path":"templates/ApprovalQueue.tsx","sha256":"sha256:34a381a30ea84246215caea6fd4cd837d42f2b721c93f3cd35397a6418b37c56"},{"path":"tests/test_package.py","sha256":"sha256:cfb52370f97db13727f11f6afb5773657e67a9d9523a9d38e562d466e04b4f80"},{"path":"trust.json","sha256":"sha256:0ed856dff90933ee8d140efa2b99b88ff334af64677662bee08accdb8cf6759b"}],"key":"ui.approval-queue","lifecycle":"golden","output_slots":["frontend/features/approval-queue"],"package_root":".","provides":["ui.approval.queue"],"requires":[{"key":"ui.app-shell","version":"2.1.0"}],"schema_version":"factory-component/v1","verification":{"license_expression":"MIT","license_list_version":"3.0","provenance_reference":null,"sbom_reference":null,"source_revision":"c0ffee0","status":"passed","verified_at":"2026-07-26T00:00:00Z"},"version":"2.1.0"}