{"category":"ui","compatibility":{"application_definition":"factory/v1","profile":"internal-approval-app"},"digest":"sha256:80e4b9be9e9658dec8023b166a600f4f15956e733add7507f63c108e0f2b9bc4","input_schema":{"additionalProperties":false,"properties":{"audit_heading":{"minLength":1,"type":"string"},"navigation":{"items":{"additionalProperties":false,"properties":{"href":{"pattern":"^/","type":"string"},"label":{"minLength":1,"type":"string"}},"required":["label","href"],"type":"object"},"minItems":1,"type":"array"},"product_name":{"minLength":1,"type":"string"}},"required":["product_name","audit_heading","navigation"],"type":"object"},"inventory":[{"path":"adapter.json","sha256":"sha256:b1a389d0432a159509f74d3e4894d769c5731eab0f503fceac06a9568da70439"},{"path":"canonical-ui.json","sha256":"sha256:d6b7ec332c688b1d70e36324159b7ccea4fac14c59e81d67d7b463ac3b817977"},{"path":"fixtures/valid-input.json","sha256":"sha256:088b2d4296849ad8adfd859af437d8520a76bd4f05e4228403de64e1bc8c064f"},{"path":"templates/ApplicationShell.tsx","sha256":"sha256:54742266b862655ecce463962ddb4f20064f3b97063dffd5f8b78dcba4447bb3"},{"path":"templates/AuditLog.tsx","sha256":"sha256:5d22f62a82061310e261f8d40e48d2f368412af200770b5155b81b5ac6c7bf23"},{"path":"templates/factory-ui.css","sha256":"sha256:0e88314b5b3c8a1418b487cd4657e8576c710cc2b1d129631ec4fb18a961b4af"},{"path":"templates/tokens.css","sha256":"sha256:d5993a5b2286fc9e781088649a18dc2218cd7d00b848deb3c0c7d25759b3a55a"},{"path":"tests/test_package.py","sha256":"sha256:79eab9eeac27185c8d5e0f0cace789abe165f32e6f97b9836bc275a3ac6bbabe"},{"path":"trust.json","sha256":"sha256:505ebc73a837fa7b92fd4280acadc1bace997934c3f197ac99b86107c76da1c0"}],"key":"ui.app-shell","lifecycle":"candidate","output_slots":["frontend/app-shell","frontend/features/audit"],"package_root":".","provides":["ui.application.shell","ui.application.audit-view"],"requires":[],"schema_version":"factory-component/v1","verification":{"license_expression":"MIT","license_list_version":"3.0","provenance_reference":null,"sbom_reference":null,"source_revision":"c0ffee0","status":"passed","verified_at":"2026-07-26T00:00:00Z"},"version":"2.3.0"}
