{"category":"ui","compatibility":{"application_definition":"factory/v1","profile":"internal-approval-app"},"digest":"sha256:a044da4a45d7fc37d3ef65da345366429db30fdb5339e0702a71edb8acfdaaa8","input_schema":{"additionalProperties":false,"properties":{"headline":{"minLength":1,"type":"string"},"summary":{"minLength":1,"type":"string"}},"required":["headline","summary"],"type":"object"},"inventory":[{"path":"adapter.json","sha256":"sha256:a1c9e83818edae90aa9b5044b2a488dedd494af8660cde9931b46493a5ebe384"},{"path":"canonical-ui.json","sha256":"sha256:d6b7ec332c688b1d70e36324159b7ccea4fac14c59e81d67d7b463ac3b817977"},{"path":"fixtures/valid-input.json","sha256":"sha256:081e0abf2e035693be4485e311d1e76675b1529d29e201875f3cd894e76b24b3"},{"path":"templates/HomePage.tsx","sha256":"sha256:3b584ddcb184451e5ff7836b59de147e65d6f0ad599b1da0d63826d44c7d0954"},{"path":"tests/test_package.py","sha256":"sha256:74859e1d6711a3917b118678b5c1992c0380236605adc9cb688c217b04e56e3f"},{"path":"trust.json","sha256":"sha256:a17de40e4dbcbbf0e8a9c6f6feccc327e498e20657119fdf8b2d9f2682ee28ae"}],"key":"ui.home-page","lifecycle":"candidate","output_slots":["frontend/routes/home"],"package_root":".","provides":["ui.route.home"],"requires":[{"key":"ui.app-shell","version":"2.3.0"}],"schema_version":"factory-component/v1","verification":{"license_expression":"MIT","license_list_version":"3.0","provenance_reference":null,"sbom_reference":null,"source_revision":"c0ffee0","status":"passed","verified_at":"2026-07-26T00:00:00Z"},"version":"2.3.0"}
