{"category":"ui","compatibility":{"application_definition":"factory/v1","profile":"internal-approval-app"},"digest":"sha256:2e6d4eb16cfd3fc0a05704179d304b51bee18af4aed26ac1087e38d1bd93a5ac","input_schema":{"additionalProperties":false,"properties":{"audit_heading":{"minLength":1,"type":"string"},"navigation":{"items":{"additionalProperties":false,"properties":{"href":{"pattern":"^/","type":"string"},"label":{"minLength":1,"type":"string"}},"required":["label","href"],"type":"object"},"minItems":1,"type":"array"},"product_name":{"minLength":1,"type":"string"}},"required":["product_name","audit_heading","navigation"],"type":"object"},"inventory":[{"path":"adapter.json","sha256":"sha256:2de9ae1d1c33ed80574ab4f8fbd782522d2bd51557ba215da98c5f6b7aec0e12"},{"path":"canonical-ui.json","sha256":"sha256:c4ff57882077deff5c6b5f0ecf39a46d256ee5d43fe234341e3ab805cac51d05"},{"path":"fixtures/valid-input.json","sha256":"sha256:088b2d4296849ad8adfd859af437d8520a76bd4f05e4228403de64e1bc8c064f"},{"path":"templates/ApplicationShell.tsx","sha256":"sha256:f6e618b3e46a071b861542fb894f2dfb614fabe68b4f23ba3ef57115b4de8b13"},{"path":"templates/AuditLog.tsx","sha256":"sha256:7873b9656c706f72cac887aac810dffd6c17499ba1a1a24f36e3e9ee762ce77d"},{"path":"templates/factory-ui.css","sha256":"sha256:079098c4ba3f06450bc5cd823f49419cc11aa545dcf6fc46f6ba86221207c6fa"},{"path":"templates/tokens.css","sha256":"sha256:d5993a5b2286fc9e781088649a18dc2218cd7d00b848deb3c0c7d25759b3a55a"},{"path":"tests/test_package.py","sha256":"sha256:67311ad365f7b0951bcfffba4a9fd952dff3dd91e681586257b1d272e5679795"},{"path":"trust.json","sha256":"sha256:ded6b4ad888dbcdcb033e2a48fdacc3dc6ec677c962248c841786e9c3cfe2da9"}],"key":"ui.app-shell","lifecycle":"candidate","output_slots":["frontend/app-shell","frontend/features/audit"],"package_root":".","provides":["ui.application.shell","ui.application.audit-view"],"requires":[],"schema_version":"factory-component/v1","verification":{"license_expression":"MIT","license_list_version":"3.0","provenance_reference":null,"sbom_reference":null,"source_revision":"c0ffee0","status":"passed","verified_at":"2026-07-26T00:00:00Z"},"version":"2.2.0"}
