{"category":"ui","compatibility":{"application_definition":"factory/v1","profile":"internal-approval-app"},"digest":"sha256:9b2d448433e863e13383e4b7869236cfe582e49747da424945010fd8d4d89322","input_schema":{"additionalProperties":false,"properties":{"headline":{"minLength":1,"type":"string"},"summary":{"minLength":1,"type":"string"}},"required":["headline","summary"],"type":"object"},"inventory":[{"path":"adapter.json","sha256":"sha256:a00d91cbd72d82e2c99fee026cb087a6c422723dbb161945e6659f8a4633586c"},{"path":"canonical-ui.json","sha256":"sha256:6fa7cbcc0b48ce9e2f01db76e3b738e80119e096570e6d1d634c725dda3916bf"},{"path":"fixtures/valid-input.json","sha256":"sha256:081e0abf2e035693be4485e311d1e76675b1529d29e201875f3cd894e76b24b3"},{"path":"templates/HomePage.tsx","sha256":"sha256:6a472fd85e2512a6e63e7d160fa5aa6c2189cca5cbc1d6ed15e247ee7a229822"},{"path":"tests/test_package.py","sha256":"sha256:e5d60e4452e5e6198ef81573c76f388aa75f081fcb7dba83f0b192b44aa6417c"},{"path":"trust.json","sha256":"sha256:8d3850dad74985481447d1487f4170cc0f4c488a86f0dbcaed54b0e0669db14b"}],"key":"ui.home-page","lifecycle":"golden","output_slots":["frontend/routes/home"],"package_root":".","provides":["ui.route.home"],"requires":[{"key":"ui.app-shell","version":"2.1.0"}],"schema_version":"factory-component/v1","verification":{"license_expression":"MIT","license_list_version":"3.0","provenance_reference":null,"sbom_reference":null,"source_revision":"c0ffee0","status":"passed","verified_at":"2026-07-26T00:00:00Z"},"version":"2.1.0"}